{
  "$schema": "schemas/team.schema.json",
  "version": "3.0.0",
  "name": "AgenticTeam",
  "description": "A portable, evidence-gated AI delivery organization with native harness adapters, progressive context, fusion councils, and safe autonomy.",
  "defaults": {
    "harness": "claude-code",
    "preset": "full-company",
    "autonomy": "hitl",
    "entry_mode": "idea",
    "context_method": "adaptive",
    "context_target_tokens": {"min": 2000, "max": 8000},
    "model_profile": "balanced"
  },
  "agents": [
    {"id":"ceo","file":"agents/leadership/ceo.md","department":"leadership","tier":"deep","access":"orchestrate","reports_to":"human-owner","capabilities":["intake","routing","gates","arbitration","reporting"],"preload_skills":["agentic-build"]},
    {"id":"cto-architect","file":"agents/leadership/cto-architect.md","department":"leadership","tier":"deep","access":"workspace-write","reports_to":"ceo","capabilities":["architecture","contracts","technology-selection"]},
    {"id":"product-manager","file":"agents/leadership/product-manager.md","department":"leadership","tier":"deep","access":"workspace-write","reports_to":"ceo","capabilities":["product-definition","requirements","scope"]},
    {"id":"delivery-lead","file":"agents/leadership/delivery-lead.md","department":"leadership","tier":"deep","access":"orchestrate","reports_to":"ceo","capabilities":["task-graph","dispatch","readiness","retrospective"],"preload_skills":["agentic-build"]},

    {"id":"backend-lead","file":"agents/engineering/backend-lead.md","department":"engineering","tier":"standard","access":"workspace-write","reports_to":"delivery-lead","capabilities":["backend","review","reference-slice"]},
    {"id":"backend-engineer","file":"agents/engineering/backend-engineer.md","department":"engineering","tier":"standard","access":"workspace-write","reports_to":"backend-lead","capabilities":["backend","api","services"]},
    {"id":"frontend-lead","file":"agents/engineering/frontend-lead.md","department":"engineering","tier":"standard","access":"workspace-write","reports_to":"delivery-lead","capabilities":["frontend","review","design-system"]},
    {"id":"frontend-engineer","file":"agents/engineering/frontend-engineer.md","department":"engineering","tier":"standard","access":"workspace-write","reports_to":"frontend-lead","capabilities":["frontend","ui","browser"]},
    {"id":"fullstack-engineer","file":"agents/engineering/fullstack-engineer.md","department":"engineering","tier":"standard","access":"workspace-write","reports_to":"delivery-lead","capabilities":["fullstack","vertical-slice","prototype"]},
    {"id":"database-engineer","file":"agents/engineering/database-engineer.md","department":"engineering","tier":"standard","access":"workspace-write","reports_to":"backend-lead","capabilities":["database","schema","migrations"]},
    {"id":"devops-engineer","file":"agents/engineering/devops-engineer.md","department":"engineering","tier":"standard","access":"workspace-write","reports_to":"delivery-lead","capabilities":["ci","infrastructure","deployment"]},
    {"id":"security-engineer","file":"agents/engineering/security-engineer.md","department":"engineering","tier":"deep","access":"review","reports_to":"delivery-lead","capabilities":["threat-model","security-review","abuse-cases"]},
    {"id":"qa-lead","file":"agents/engineering/qa-lead.md","department":"engineering","tier":"deep","access":"review","reports_to":"delivery-lead","capabilities":["test-strategy","acceptance","release-gate"],"preload_skills":["agentic-verify"]},
    {"id":"test-engineer","file":"agents/engineering/test-engineer.md","department":"engineering","tier":"standard","access":"workspace-write","reports_to":"qa-lead","capabilities":["test-automation","regression","e2e"]},
    {"id":"code-reviewer","file":"agents/engineering/code-reviewer.md","department":"engineering","tier":"deep","access":"review","reports_to":"delivery-lead","capabilities":["code-review","correctness","maintainability"]},
    {"id":"integration-engineer","file":"agents/engineering/integration-engineer.md","department":"engineering","tier":"standard","access":"workspace-write","reports_to":"backend-lead","capabilities":["integrations","webhooks","payments"]},
    {"id":"ai-ml-engineer","file":"agents/engineering/ai-ml-engineer.md","department":"engineering","tier":"standard","access":"workspace-write","reports_to":"backend-lead","capabilities":["ai","ml","rag","llm-integration"]},
    {"id":"data-engineer","file":"agents/engineering/data-engineer.md","department":"engineering","tier":"standard","access":"workspace-write","reports_to":"backend-lead","capabilities":["data-pipeline","etl","warehouse","data-quality"]},
    {"id":"mobile-engineer","file":"agents/engineering/mobile-engineer.md","department":"engineering","tier":"standard","access":"workspace-write","reports_to":"frontend-lead","capabilities":["mobile","ios","android"]},
    {"id":"ux-ui-designer","file":"agents/engineering/ux-ui-designer.md","department":"engineering","tier":"standard","access":"workspace-write","reports_to":"product-manager","capabilities":["ux","ui","design-system"]},

    {"id":"build-integrator","file":"agents/specialists/build-integrator.md","department":"specialists","tier":"deep","access":"workspace-write","reports_to":"delivery-lead","capabilities":["merge","integration","conflict-resolution"],"activate_when":["parallel-writers","multi-worktree"]},
    {"id":"platform-admin-engineer","file":"agents/specialists/platform-admin-engineer.md","department":"specialists","tier":"standard","access":"workspace-write","reports_to":"delivery-lead","capabilities":["admin-console","backoffice","operations"],"activate_when":["admin-console","back-office","ops-console","internal-tools"]},
    {"id":"trust-and-safety-specialist","file":"agents/specialists/trust-and-safety-specialist.md","department":"specialists","tier":"standard","access":"workspace-write","reports_to":"product-manager","capabilities":["content-policy","moderation-workflows","appeals","abuse-response"],"activate_when":["user-generated-content","moderation","content-policy","trust-and-safety","comments","uploads","report-abuse"]},
    {"id":"fraud-risk-analyst","file":"agents/specialists/fraud-risk-analyst.md","department":"specialists","tier":"deep","access":"read-only","reports_to":"delivery-lead","capabilities":["fraud-detection","risk-rules","chargebacks","velocity-limits"],"activate_when":["payments","marketplace","fraud","chargebacks","financial-risk","checkout","refunds","payouts"]},
    {"id":"eval-engineer","file":"agents/specialists/eval-engineer.md","department":"specialists","tier":"deep","access":"workspace-write","reports_to":"qa-lead","capabilities":["evals","golden-sets","model-regression","llm-quality"],"activate_when":["ai-features","llm","retrieval-augmented","evals","model-behavior","chatbot","embeddings","llm-feature","prompt"]},
    {"id":"sre-engineer","file":"agents/specialists/sre-engineer.md","department":"specialists","tier":"deep","access":"workspace-write","reports_to":"delivery-lead","capabilities":["reliability","incidents","slo","backup"],"activate_when":["uptime","slo","sla","on-call","availability-target","incident-response"]},
    {"id":"performance-engineer","file":"agents/specialists/performance-engineer.md","department":"specialists","tier":"deep","access":"review","reports_to":"delivery-lead","capabilities":["profiling","load-test","performance-budget"],"activate_when":["scale","latency","high-traffic","p95","throughput","load-test"]},
    {"id":"accessibility-specialist","file":"agents/specialists/accessibility-specialist.md","department":"specialists","tier":"deep","access":"review","reports_to":"qa-lead","capabilities":["accessibility","wcag","assistive-tech"],"activate_when":["user-interface","public-sector","accessibility","wcag","web-ui","forms","dashboard"]},
    {"id":"privacy-engineer","file":"agents/specialists/privacy-engineer.md","department":"specialists","tier":"deep","access":"review","reports_to":"delivery-lead","capabilities":["privacy","data-minimization","data-retention"],"activate_when":["pii","personal-data","health-data","financial-data","child-data","minors","gdpr"]},
    {"id":"release-manager","file":"agents/specialists/release-manager.md","department":"specialists","tier":"deep","access":"workspace-write","reports_to":"delivery-lead","capabilities":["release","rollback","change-management"],"activate_when":["production-release","multi-service"]},
    {"id":"analytics-engineer","file":"agents/specialists/analytics-engineer.md","department":"specialists","tier":"standard","access":"workspace-write","reports_to":"product-manager","capabilities":["product-analytics","events","metrics","experiments"],"activate_when":["analytics","experiments","event-tracking","a-b-test"]},
    {"id":"finops-engineer","file":"agents/specialists/finops-engineer.md","department":"specialists","tier":"standard","access":"read-only","reports_to":"cto-architect","capabilities":["cost-model","cloud-cost","unit-economics"],"activate_when":["cloud-cost","high-volume","cost-ceiling","budget-cap"]},
    {"id":"localization-specialist","file":"agents/specialists/localization-specialist.md","department":"specialists","tier":"standard","access":"workspace-write","reports_to":"product-manager","capabilities":["i18n","l10n","rtl","locale-testing"],"activate_when":["multilingual","international","right-to-left","i18n","l10n","locale"]},
    {"id":"compliance-advisor","file":"agents/specialists/compliance-advisor.md","department":"specialists","tier":"deep","access":"read-only","reports_to":"ceo","capabilities":["compliance","evidence","policy-mapping"],"activate_when":["regulated","gdpr","hipaa","pci","soc2"],"limitations":"Advisory only; not a substitute for qualified legal counsel."},